{
  "schemaVersion": "modbus-simulator.fixture.v1",
  "name": "codec-network",
  "description": "One example per network codec from modbus-simulator codecs list (2 entries).",
  "devices": [
    {
      "unitId": 1,
      "state": {
        "holdingRegisters": [
          {
            "address": 0,
            "codec": "ip_addr",
            "value": "192.168.1.10",
            "name": "ip_addr"
          },
          {
            "address": 2,
            "codec": "ipv6_addr",
            "value": "2001:db8::1",
            "name": "ipv6_addr"
          }
        ]
      }
    }
  ]
}
