{
  "$schema": "../schemas/fixture-v1.json",
  "schemaVersion": "modbus-simulator.fixture.v1",
  "name": "fc02-read-discrete-inputs",
  "description": "FC02 read discrete inputs — read addresses 0–2 (false, true, false). Read-only area.",
  "devices": [
    {
      "unitId": 1,
      "name": "discrete-input-reader",
      "state": {
        "discreteInputs": [
          { "address": 0, "value": false },
          { "address": 1, "value": true },
          { "address": 2, "value": false }
        ]
      }
    }
  ]
}
