{
  "schemaVersion": "modbus-simulator.fixture.v1",
  "name": "codec-datetime",
  "description": "One example per time codec from modbus-simulator codecs list (8 entries).",
  "devices": [
    {
      "unitId": 1,
      "state": {
        "holdingRegisters": [
          {
            "address": 0,
            "codec": "datetime2_s2000",
            "value": "2024-06-15T12:30:00Z",
            "name": "datetime2_s2000"
          },
          {
            "address": 2,
            "codec": "datetime3_s2000",
            "value": "2024-06-15T12:30:00Z",
            "name": "datetime3_s2000"
          },
          {
            "address": 5,
            "codec": "datetime_iec870",
            "value": "2024-06-15T12:30:00Z",
            "name": "datetime_iec870"
          },
          {
            "address": 9,
            "codec": "datetime_iec870_local",
            "value": "2024-06-15T12:30:00Z",
            "name": "datetime_iec870_local"
          },
          {
            "address": 13,
            "codec": "datetime_iec870_utc",
            "value": "2024-06-15T12:30:00Z",
            "name": "datetime_iec870_utc"
          },
          {
            "address": 17,
            "codec": "datetime_ymdhms",
            "value": "2024-06-15T12:30:00Z",
            "name": "datetime_ymdhms"
          },
          {
            "address": 23,
            "codec": "datetime_ymdhms_local",
            "value": "2024-06-15T12:30:00Z",
            "name": "datetime_ymdhms_local"
          },
          {
            "address": 29,
            "codec": "datetime_ymdhms_utc",
            "value": "2024-06-15T12:30:00Z",
            "name": "datetime_ymdhms_utc"
          }
        ]
      }
    }
  ]
}
