{
  "$schema": "../schemas/fixture-v1.json",
  "schemaVersion": "modbus-simulator.fixture.v1",
  "name": "fc23-read-write-multiple-registers",
  "description": "FC23 read/write multiple registers — write addresses 10-11, then read addresses 9-12 in the same request (the read sees the write).",
  "devices": [
    {
      "unitId": 1,
      "name": "read-writer",
      "state": {
        "holdingRegisters": [
          { "address": 9, "value": 100, "writable": false },
          { "address": 10, "value": 0, "writable": true },
          { "address": 11, "value": 0, "writable": true },
          { "address": 12, "value": 400, "writable": false }
        ]
      }
    }
  ]
}
