{
  "schemaVersion": "modbus-simulator.fixture.v1",
  "name": "codec-floats",
  "description": "One example per float codec from modbus-simulator codecs list (8 entries).",
  "devices": [
    {
      "unitId": 1,
      "state": {
        "holdingRegisters": [
          {
            "address": 0,
            "codec": "float32/layout:1234",
            "value": 230.5,
            "name": "float32_layout_1234"
          },
          {
            "address": 2,
            "codec": "float32/layout:2143",
            "value": 230.5,
            "name": "float32_layout_2143"
          },
          {
            "address": 4,
            "codec": "float32/layout:3412",
            "value": 230.5,
            "name": "float32_layout_3412"
          },
          {
            "address": 6,
            "codec": "float32/layout:4321",
            "value": 230.5,
            "name": "float32_layout_4321"
          },
          {
            "address": 8,
            "codec": "float64/layout:12345678",
            "value": 123.456789,
            "name": "float64_layout_12345678"
          },
          {
            "address": 12,
            "codec": "float64/layout:21436587",
            "value": 123.456789,
            "name": "float64_layout_21436587"
          },
          {
            "address": 16,
            "codec": "float64/layout:78563412",
            "value": 123.456789,
            "name": "float64_layout_78563412"
          },
          {
            "address": 20,
            "codec": "float64/layout:87654321",
            "value": 123.456789,
            "name": "float64_layout_87654321"
          }
        ]
      }
    }
  ]
}
