{
  "$schema": "../schemas/fixture-v1.json",
  "schemaVersion": "modbus-simulator.fixture.v1",
  "name": "fc05-write-single-coil",
  "description": "FC05 write single coil — write address 10 (initially false, writable).",
  "devices": [
    {
      "unitId": 1,
      "name": "coil-writer",
      "state": {
        "coils": [
          { "address": 10, "value": false, "writable": true }
        ]
      }
    }
  ]
}
